<?xml version="1.0" encoding="UTF-8"?>
<project ID="0" xmlns:xsi="http://www.w3.org/2001/XMLSchema-instance" xsi:noNamespaceSchemaLocation="../schemas/projects_schema.xsd">
  <projectname>projectname</projectname>
  <lastMod>lastMod</lastMod>
  <description>description</description>
  <taskEntries ID="0">
    <taskname>taskname</taskname>
    <statusname>statusname</statusname>
    <lastMod>lastMod</lastMod>
    <comment>comment</comment>
    <color>0</color>
    <lastUser>lastUser</lastUser>
    <tags>tags</tags>
  </taskEntries>
  <statusEntries length="0">
    <status>status</status>
  </statusEntries>
</project>
